{"schema":"distributed_world_simulator.harness_evidence_map.v1","work_order_id":"V0-P4-R1-WO-001","program":"V0","checkpoint":"V0_P4_REAL_RESOURCE_CONSTRUCTION","risk_class":"HIGH","evidence_head_sha":"2a6721cdf02fa1134c59d1ab98bb7b597c66821d","intent":"Final checkpoint-time Evidence Map for the frozen P4 implementation after independent runtime Reviewer/Verifier PASS, accepted directional clearance, current-main R2 control revalidation, and fresh R2 closure-carrier review.","root_cause_or_reason":"P4 closes mine -> canonical ore -> deterministic allocation -> atomic canonical Item Graph debit plus Construction commit -> two-client/reconnect convergence without duplicate authority. Closure recovery only materializes already-proven predicates under generation-80 guards; runtime remains frozen.","changed_surfaces":["Construction exact-consume planning and validation","deterministic requesting-player material allocation","live M4 single-owner Construction transaction port","post-commit Item Graph delta plus Construction event publication/fallback","real ENet two-client and reconnect acceptance","world/core regression debt repair already independently reviewed and integrated"],"canonical_owner":"Canonical M4 Item Graph remains the sole item/resource truth; existing Construction authority/M0 remains the sole Construction truth.","entry_points":["M3 dedicated-server gameplay command handling","Construction multiplayer gateway/executor","P4 live M4 Construction build process","P3 authoritative resource mining request path"],"callers":["M3 real ENet clients through existing COMMAND_REQUEST path","Earth MVP live runtime composition","P4 focused and process acceptance drivers"],"callees":["V0P4ConstructionMaterialAllocator","V0P4LiveM4ConstructionTransactionPort","ConstructionBuildProcess / ConstructionStageTransactionPlanner","AuthoritativeConstructionItemGraphAdapter / Construction M0 bridge","canonical M4 server-only material-consume seam","M3 Item Graph/Construction replication publication"],"sibling_surfaces_checked":["P4.1 exact consume","P4.2 allocator","P4.3 generic transaction port","P4.3 authoritative adapter + M0","P4.4 live composition","P4.5 publication/fallback","P4.6 real ENet two-client/reconnect","P3 live mining reconnect","M4 canonical gameplay","M3 Construction bridge","M5 graphical multiplayer acceptance","M6 dedicated recovery","M7 playable recovery","full 236-test world/core + V0 overlay sweep","main-scene --run-tests=all","generation-80 Project Control","current-main standard/directional PC0","sequential V0/P product-train guards"],"canonical_truth_changed":true,"architecture_ownership_changed":false,"focused_validation":"PASS","full_regression":"PASS","pc0":"NON_RED","directional_pc0":"NON_RED","production_diff_summary":"Frozen implementation target 2a6721cdf... reuses existing canonical M4 Item Graph and Construction/M0 owners. Closure repair/finalization are control/evidence only; no second Item Graph, persistence owner, resource-balance truth, network authority, or P5 runtime owner is introduced.","remaining_risks":["P4 proves a bounded canonical ore economy loop, not a general multi-resource crafting framework.","Full-snapshot publication fallback is correctness-first and may be expensive under later scale targets.","The M4 + Construction/M0 atomic sequence is intentionally narrow and is not a general distributed transaction framework.","Formal P4 acceptance and P5 activation remain separate main-owned Director/control gates."],"required_fixes":[],"rank_up_moves":["After formal P4 acceptance, activate P5 from the exact main-declared accepted P4 lineage rather than expanding P4.","Future CI may shard the complete world/core gate while preserving fail-closed discovery."],"evidence_gaps":[],"review_verdict":"PASS"}
